{
  "schemaVersion": 1,
  "protocolVersion": 1,
  "taskId": "TASK-001",
  "contractFingerprint": "602eb28811d403d9b2fbcfa84397aa4c4cbb50101dd6a781d6a484bc1e94e26d",
  "routeFingerprint": "91399201a7d304b09f126e1cf48317611e2e82253e6d46e61f8aa837abca6b69",
  "repositoryFingerprint": {
    "branch": "main",
    "head": "3f9c1d2e77a4b5089c6e12ab34f5d6e7890abcde"
  },
  "phase": "COMPLETE",
  "revision": 3,
  "selectedGuides": [
    "test",
    "clean"
  ],
  "requiredGates": [
    "unit-tests",
    "typecheck",
    "lint"
  ],
  "satisfiedGates": [
    "unit-tests",
    "typecheck",
    "lint"
  ],
  "complianceMode": "standard",
  "completedSteps": [
    "Model product entries",
    "Implement filtering",
    "Build grid view",
    "Verify with unit tests"
  ],
  "pendingSteps": [],
  "checks": [
    {
      "schemaVersion": 1,
      "protocolVersion": 1,
      "id": "catalog-unit-tests",
      "kind": "command",
      "requirement": "Catalog unit tests pass",
      "status": "passed",
      "evidenceKind": "OBSERVED",
      "source": "vitest run",
      "exitCode": 0,
      "timestamp": "2026-08-03T09:35:00.000Z",
      "executionRef": "exec-catalog-unit-tests",
      "provenance": "FORGELOOP_EXECUTED"
    },
    {
      "schemaVersion": 1,
      "protocolVersion": 1,
      "id": "typecheck",
      "kind": "command",
      "requirement": "TypeScript compiles without errors",
      "status": "passed",
      "evidenceKind": "OBSERVED",
      "source": "tsc --noEmit",
      "exitCode": 0,
      "timestamp": "2026-08-03T09:40:00.000Z",
      "executionRef": "exec-catalog-typecheck",
      "provenance": "FORGELOOP_EXECUTED"
    },
    {
      "schemaVersion": 1,
      "protocolVersion": 1,
      "id": "lint",
      "kind": "command",
      "requirement": "Lint passes on changed files",
      "status": "passed",
      "evidenceKind": "OBSERVED",
      "source": "eslint",
      "exitCode": 0,
      "timestamp": "2026-08-03T09:42:00.000Z",
      "executionRef": "exec-catalog-lint",
      "provenance": "FORGELOOP_EXECUTED"
    }
  ],
  "failures": [],
  "blockers": [],
  "verificationEvidence": [
    {
      "id": "verif-catalog-cycle-1",
      "summary": "Every success criterion observed during verification cycle 1.",
      "status": "OBSERVED",
      "timestamp": "2026-08-03T10:00:00.000Z"
    }
  ],
  "evidenceCoverage": [
    {
      "schemaVersion": 1,
      "protocolVersion": 1,
      "requirement": "Products render in a responsive grid",
      "requiredEvidence": [
        "Products render in a responsive grid"
      ],
      "observedEvidence": [
        "Products render in a responsive grid"
      ],
      "status": "COVERED"
    },
    {
      "schemaVersion": 1,
      "protocolVersion": 1,
      "requirement": "Filters combine category and price range",
      "requiredEvidence": [
        "Filters combine category and price range"
      ],
      "observedEvidence": [
        "Filters combine category and price range"
      ],
      "status": "COVERED"
    },
    {
      "schemaVersion": 1,
      "protocolVersion": 1,
      "requirement": "Catalog unit tests pass (14 cases)",
      "requiredEvidence": [
        "Catalog unit tests pass (14 cases)"
      ],
      "observedEvidence": [
        "Catalog unit tests pass (14 cases)"
      ],
      "status": "COVERED"
    },
    {
      "schemaVersion": 1,
      "protocolVersion": 1,
      "requirement": "Filtering logic covered by table-driven tests",
      "requiredEvidence": [
        "Filtering logic covered by table-driven tests"
      ],
      "observedEvidence": [
        "Filtering logic covered by table-driven tests"
      ],
      "status": "COVERED"
    }
  ],
  "lastUpdated": "2026-08-03T10:05:00.000Z",
  "verificationCycle": 1,
  "publicationStatus": "pushed"
}
