{
  "schemaVersion": 1,
  "protocolVersion": 1,
  "taskId": "conformance-blocked",
  "contractFingerprint": "aaaaaaaaaaaaaaaaaaaaaaaaaaaaaaaaaaaaaaaaaaaaaaaaaaaaaaaaaaaaaaaa",
  "repositoryFingerprint": {
    "branch": "main",
    "head": "bbbbbbbbbbbbbbbbbbbbbbbbbbbbbbbbbbbbbbbb"
  },
  "phase": "BLOCKED",
  "selectedGuides": [],
  "requiredGates": [],
  "satisfiedGates": [],
  "complianceMode": "standard",
  "completedSteps": [],
  "pendingSteps": [],
  "checks": [],
  "failures": [],
  "blockers": [
    {
      "id": "fixture-blocker",
      "reason": "FIXTURE_BLOCKED",
      "detail": "Intentional blocked scenario."
    }
  ],
  "verificationEvidence": [],
  "evidenceCoverage": [],
  "lastUpdated": "2026-01-01T00:00:00.000Z",
  "previousPhase": "EXECUTING"
}
