{
  "schemaVersion": 1,
  "protocolVersion": 1,
  "taskId": "TASK-003",
  "contractFingerprint": "47a1842cce5b1d5ea332cafa57309fcf9c60e012836257608e0bc23453d280d5",
  "routeFingerprint": "300017a260ccd885e86034f8bdbaf3f88f86f205cc5c7ce3d3b8ff5611db2ada",
  "repositoryFingerprint": {
    "branch": "main",
    "head": "3f9c1d2e77a4b5089c6e12ab34f5d6e7890abcde"
  },
  "phase": "EXECUTING",
  "revision": 0,
  "selectedGuides": [
    "security",
    "test"
  ],
  "requiredGates": [
    "integration-tests",
    "security-review"
  ],
  "satisfiedGates": [
    "integration-tests"
  ],
  "complianceMode": "standard",
  "completedSteps": [
    "API client skeleton",
    "Error mapping"
  ],
  "pendingSteps": [
    "Retry policy",
    "Security review"
  ],
  "checks": [
    {
      "schemaVersion": 1,
      "protocolVersion": 1,
      "id": "checkout-integration-tests",
      "kind": "command",
      "requirement": "Checkout integration tests pass",
      "status": "passed",
      "evidenceKind": "OBSERVED",
      "source": "vitest run",
      "exitCode": 0,
      "timestamp": "2026-08-05T09:10:00.000Z",
      "executionRef": "exec-checkout-integration-tests",
      "provenance": "FORGELOOP_EXECUTED"
    },
    {
      "schemaVersion": 1,
      "protocolVersion": 1,
      "id": "retry-policy-tests",
      "kind": "command",
      "requirement": "Retry policy handles transient failures",
      "status": "not-run",
      "evidenceKind": "NOT_VERIFIED",
      "source": "planned",
      "timestamp": "2026-08-05T09:12:00.000Z"
    }
  ],
  "failures": [],
  "blockers": [],
  "verificationEvidence": [],
  "evidenceCoverage": [
    {
      "schemaVersion": 1,
      "protocolVersion": 1,
      "requirement": "Orders submit through the client",
      "requiredEvidence": [
        "Orders submit through the client"
      ],
      "observedEvidence": [
        "Orders submit through the client"
      ],
      "status": "COVERED"
    },
    {
      "schemaVersion": 1,
      "protocolVersion": 1,
      "requirement": "Transient errors retry with backoff",
      "requiredEvidence": [
        "Transient errors retry with backoff"
      ],
      "observedEvidence": [],
      "status": "NOT_VERIFIED"
    },
    {
      "schemaVersion": 1,
      "protocolVersion": 1,
      "requirement": "Checkout integration tests pass (6 cases)",
      "requiredEvidence": [
        "Checkout integration tests pass (6 cases)"
      ],
      "observedEvidence": [
        "Checkout integration tests pass (6 cases)"
      ],
      "details": {
        "readinessStatus": "PARTIAL"
      },
      "status": "PARTIAL"
    }
  ],
  "lastUpdated": "2026-08-05T09:15:00.000Z"
}
