{
  "schemaVersion": 1,
  "protocolVersion": 1,
  "taskId": "conformance-blocked",
  "contractFingerprint": "aaaaaaaaaaaaaaaaaaaaaaaaaaaaaaaaaaaaaaaaaaaaaaaaaaaaaaaaaaaaaaaa",
  "repositoryFingerprint": {
    "branch": "main",
    "head": "fixture"
  },
  "phase": "BLOCKED",
  "selectedGuides": [],
  "completedSteps": [],
  "pendingSteps": [],
  "checks": [],
  "failures": [],
  "blockers": [],
  "lastUpdated": "2026-01-01T00:00:00.000Z"
}
